poduct_category,Product Name,Link,Image,Price,product_description,tab_discription
dal-pulses,Patanjali Unpolished Rajma (Sharmili),https://www.patanjaliayurved.net/product/natural-food-products/dal-pulses/patanjali-unpolished-rajma-sharmili/1063,https://www.patanjaliayurved.net/assets/product_images/400x500/1690277880RAJMA(SHARMILI)500g1.png,98,patanjali unpolished rajma highly nutritious red kidney bean high protein patanjali unpolished rajma tastier compared polished counterparts natural taste flavor nutrients intact reducing health risk contain harmful polishing agents,benefitsingredientshow useother product info provides essential vitamins minerals provides dietary fibrerajma soak rajma overnight pressure cook salt till cooked properly switch flame let cool itself open cooker add cooked spices likedbest before months manufacturing date
dal-pulses,Patanjali Unpolished Arhar Dal (Tuvar Dal),https://www.patanjaliayurved.net/product/natural-food-products/dal-pulses/patanjali-unpolished-arhar-dal-tuvar-dal/715,https://www.patanjaliayurved.net/assets/product_images/400x500/1590658732400x500.jpg,126,patanjali unpolished arhar dal tuvar highly nutritious high protein patanjali unpolished arhar dal tastier compared polished counterparts natural taste flavor nutrients intact reducing health risk contain harmful polishing agents,benefitsingredientshow useother product infoprovides essential vitamins mineralsno preservatives artificial food color natural ingredientsthe usp unpolished pulses free polish makes nutritional proteinsarhar dalwash dal times water runs clearadd water pot pressure cooker dal cook medium heat whistlesbest before months manufacturing date
dal-pulses,Patanjali Unpolished Chhole (Kabuli Chana),https://www.patanjaliayurved.net/product/natural-food-products/dal-pulses/patanjali-unpolished-chhole-kabuli-chana/720,https://www.patanjaliayurved.net/assets/product_images/400x500/1690960167Chhole(Kabulichana)1kg1.png,220,patanjali unpolished chhole kabuli chana chickpeas highly nutritious high protein patanjali unpolished chana tastier compared polished counterparts natural taste flavor nutrients intact reducing health risk contain harmful polishing agents,benefitsingredientsother product infohigh proteinprovides essential vitamins mineralsgreat source plantbased proteingramchickpea whitebest before months manufacturing date
dal-pulses,"Patanjali Rice & Pulse Combo(Arhar Dal - 1 kg, Sona Masoori - 5 kg) -Rs 36 Off",https://www.patanjaliayurved.net/product/natural-food-products/dal-pulses/patanjali-rice-pulse-comboarhar-dal-1-kg-sona-masoori-5-kg-rs-36-off/3384,https://www.patanjaliayurved.net/assets/product_images/400x500/1689663120Combo.png,733,rice pulse combo arhar dal kg sona masoori kgget rs wallet,product infobest days manufacturing date
rice,Patanjali Samak Rice,https://www.patanjaliayurved.net/product/natural-food-products/rice/patanjali-samak-rice/3480,https://www.patanjaliayurved.net/assets/product_images/400x500/1690019917SamakRice500g1.png,75,samak rice loaded high fibre essential minerals like iron magnesium great source energy,benefitsingredientsother product infohigh fibre essential minerals like iron magnesiumit great source energyricebest days date manufacturing
rice,Patanjali Katarani Rice,https://www.patanjaliayurved.net/product/natural-food-products/rice/patanjali-katarani-rice/1288,https://www.patanjaliayurved.net/assets/product_images/400x500/1689676070KataraniRice1kg1.png,100,patanjali katarani rice pride east india old traditional rice variety grown north east india variety non basmati rice medium size thin grains pleasing strong aroma,benefitsingredientshow useother product infoimproves nervous system healthgood source energyprevents obesitygood source proteinlight weight foodkatarani ricetake water open bowl boil add rice slowly gentle stirring cook minutes medium heat drain extra boiling water best results soak patanjali basmati rice water min cookingbest before months manufacturing date
rice,Patanjali Gold Basmati Rice,https://www.patanjaliayurved.net/product/natural-food-products/rice/patanjali-gold-basmati-rice/2458,https://www.patanjaliayurved.net/assets/product_images/400x500/1689672796GoldBasmatiRice-1kg1.png,170,patanjali gold basmati rice processed select premium quality paddy procured foothills himalayas  pure rice good source energy cholesterol trans fat free high fiber rice,benefitsingredientshow useother product info delicious unique texture aroma soaked properly cooking grains double size wont break wont stick together low cost compared brands biryani fried rice high volume expansion cooking easy digestibility longer shelflife aromatic fragrance nonsticky cooking excessive elongation cooking soft fluffy texture cooked ricegold basmati riceput boiling water open bowl add rice slowly gentle stirring cook minutes medium heat drain extra boiling waterput water rice pan tighten lid simmer minutes remove heat allow pan stand covered minutesput soaked rice add measured quantity water bowl stir select cooking option timings available oven remove oven let stand covered minutes servingbest before months manufacturing date
rice,Patanjali Shakti Rice Mogra,https://www.patanjaliayurved.net/product/natural-food-products/rice/patanjali-shakti-rice-mogra/3315,https://www.patanjaliayurved.net/assets/product_images/400x500/1689665477ShaktiXXLMogra5kg1.png,445,patanjali shakti mogra basmati rice processed selected premium quality paddy procured rice bowl states bharat like punjab haryana uttar pradesh madhya pradesh uttarakhand patanjali rice processed stateoftheart gmp plants ensure exquisite quality retention nutritive values effort ensure product reaches pristine condition patanjali shakti mogra basmati rice grains long slender grain elongates double original size cooking unique qualities coupled tempting taste patanjali basmati rice delicacy world meal patanjali rice special tantalizing flavour magical aroma delicious fluffy texture,benefitsingredientshow useother product infoimproves nervous system healthgood source energyprevents obesitygood source proteinlight weight foodbasmati riceput boiling water open bowl add rice slowly gentle stirring cook minutes medium heat drain extra boiling waterput water rice pan tighten lid simmer minutes remove heat allow pan stand covered minutesput soaked rice add measured quantity water bowl stir select cooking option timings available oven remove oven let stand covered minutes serving  watt oven use g basmati rice timebest before months manufacturing date
rice,Patanjali Sona Masoori Rice,https://www.patanjaliayurved.net/product/natural-food-products/rice/patanjali-sona-masoori-rice/1169,https://www.patanjaliayurved.net/assets/product_images/400x500/1689676763Sonamassoririce-1kg1.png,119,patanjali sona masoori rice processed select premium quality paddy procured rich belt telangana produces best quality sona masoori crop patanjali sona masoori rice processed state art plants exquisite quality retention nutritive values effort ensure product reaches pristine conditionpatanjali sona masoori light weight aromatic completes search perect rice patanjali sona masoori id ideal rice sweet sweet pongal biryani idlis fried rice,benefitsingredientshow useother product infohigher starcheasier digestion bulkier stoolslower fat fewer calories aids weight losspacked nutrients iron calcium potassium manganese selenium better cell healthlower sodium regulates blood pressurerich proteinsona masoori ricetake water boil add rice slowly gentle stirring cook minutes medium heat drain extra boiling water best results soak patanjali basmati rice water min cookingbest before months manufacturing date
rice,Patanjali Brown Basmati Rice,https://www.patanjaliayurved.net/product/natural-food-products/rice/patanjali-brown-basmati-rice/898,https://www.patanjaliayurved.net/assets/product_images/400x500/1689747996BrownBasmatiRice1kg1.png,160,unique process produces brown basmati rice removes outermost layer hull rice kernel damaging nutritional value patanjali brown basmati rice highly famous great fragrance great taste,benefitsingredientshow useother product infostrong aromaimproves nervous system healthgood source energyprevents obesitygood source protein magnesiumbrown riceopen pan bring water rolling boil add rice stir gently cook uncovered medium heat till rice drain extra waterclose pan bring water boil cover pan lid let simmer minutes remove heat let stand minutes servingmicro waveput soaked rice water bowl stir covered pierce cling film let stand covered minutes remove oven let stand covered for minutes serving watt microwave oven grams rice timeelectric cookerput soaked rice cooker add measured water switch cooker cooker automatically switch cook keep warm mode allow rice tosteam warm mode servingbest months date packaging
rice,Patanjali Dubar Basmati Rice,https://www.patanjaliayurved.net/product/natural-food-products/rice/patanjali-dubar-basmati-rice/1282,https://www.patanjaliayurved.net/assets/product_images/400x500/16896764731.jpg,130,patanjali shakti dubar basmati rice processed select premium quality paddy procured rice bowl states bharat like punjab haryana uttar pradesh madhya pradesh uttrakhandpatanjali rice processed state art gmp plants ensure exquisite quality retention nutritive value effort ensure product reaches customer pristine conditionpatanjali shakti dubar basmati rice grains long slender grain elongates double original size cookingthese unique qualities coupled tempting taste patanjali basmati rice delicacy world overevery meal patanjali rice special tantalizing flavour magical aroma delicious fluffy texture,benefitsingredientshow useother product info light weight aromatic unique texture coupled tempting taste low cost compared brands aromatic fragrance nonsticky cooking soaked properly cooking grains double size wont break soft non sticky rice cookingbasmati riceput boiling water open bowl add rice slowly gentle stirring cook minutes medium heat drain extra boiling waterput water rice pan tighten lid simmer minutes remove heat allow pan stand covered minutesput soaked rice add measured quantity water bowl stir select cooking option timings available oven remove oven let stand covered minutes serving  watt oven use g basmati rice timebest before months manufacturing date
rice,Patanjali Super Basmati Rice,https://www.patanjaliayurved.net/product/natural-food-products/rice/patanjali-super-basmati-rice/864,https://www.patanjaliayurved.net/assets/product_images/400x500/1689748165SuperBasmatiRice1kg1.png,160,patanjali super basmati rice processed selected premium quality paddy procured foothills himalayas rice bowl states bharat like punjab haryana uttar pradesh madhya pradesh uttarakhandpatanjali rice processed state art gmp plants ensure exquisite quality retention nutritive values effort ensure product reaches pristine condition patanjali super basmati rice grains long slender grains elongates double original size cooking unique qualities coupled tempting taste patanjali super basmati rice delicacy world meal patanjali rice special tantalizing flavour magical aroma delicious fluffy texture,benefitsingredientshow useother product info delicious unique texture aroma soaked properly cooking grains double size wont break wont stick together low cost compared brands biryani fried rice high volume expansion cooking easy digestibility longer shelflife aromatic fragrance nonsticky cooking excessive elongation cooking soft fluffy texture cooked ricesuper basmati riceopen pan boiling water open bowl add rice slowly gentle stirring cook minutes medium heat drain extra boiling waterclosed pan water rice pan tighten lid simmer minutes remove heat allow pan stand covered minutesmicrowave soaked rice add measured quantity water bowl stir select cooking option timings available oven remove oven let stand covered minutes serving  watt oven use g basmati rice timeautomatic electric rice cooker soaked rice cooker add measured quantity water switch cooker cooking cooker automatically switch cook mode warm mode allow rice steam mode servingbest before months manufacturing date
rice,Patanjali Tibar Basmati Rice,https://www.patanjaliayurved.net/product/natural-food-products/rice/patanjali-tibar-basmati-rice/1289,https://www.patanjaliayurved.net/assets/product_images/400x500/1689675949PatanjaliTibarBasmatiRice1kg1.png,140,patanjali tibar basmati rice processed selected premium quality paddy procured foothills himalayas rice bowl states bharat like punjab haryana uttar pradesh madhya pradesh uttarakhand patanjali rice processed state art gmp plants ensure exquisite quality retention nutritive values effort ensure product reaches pristine conditionthese unique qualities coupled tempting taste patanjali basmati rice delicacy world meal patanjali rice special tantalizing flavour magical aroma delicious fluffy texture,benefitsingredientshow useother product info delicious unique texture aroma soaked properly cooking grains double size wont break wont stick together low cost compared brands biryani fried rice high volume expansion cooking easy digestibility longer shelflife aromatic fragrance nonsticky cooking excessive elongation cooking soft fluffy texture cooked ricebasmati riceopen pan boiling water open bowl add rice slowly gentle stirring cook minutes medium heat drain extra boiling waterclosed pan water rice pan tighten lid simmer minutes remove heat allow pan stand covered minutesmicrowave soaked rice add measured quantity water bowl stir select cooking option timings available oven remove oven let stand covered minutes serving  watt oven use g basmati rice timeautomatic electric rice cooker soaked rice cooker add measured quantity water switch cooker cooking cooker automatically switch cook mode warm mode allow rice steam mode servingbest before months manufacturing date
rice,Patanjali Basmati Rice Silver,https://www.patanjaliayurved.net/product/natural-food-products/rice/patanjali-basmati-rice-silver/1262,https://www.patanjaliayurved.net/assets/product_images/400x500/1689676694SilverBasmatiRice1kg1.png,140,patanjali brings worldrenowned indian basmati rice highly prized delicious unique texture aroma rice come foot hills himalaya grain individually sorted colur sorter machine meal special occasion,benefitsingredientshow useother product info delicious unique texture aroma soaked properly cooking grains double size wont break wont stick together low cost compared brands biryani fried rice high volume expansion cooking easy digestibility longer shelflife aromatic fragrance nonsticky cooking excessive elongation cooking soft fluffy texture cooked ricebasmati rice oryza sativaopen pan boil cups water add cup g rice stir occasionally cook uncovered medium heat min drain excess water pan fluff fork servepressure cooker boil half cups  ml water add cup g rice stir occasionally cover pan tight lid allow cook min remove pan heat let cool min fluff fork servemicrowave place presoaked rice one cup g soaked half cup water  ml loosely microwaveable bowl cover cling film cook recommended remove bowl oven let stand min fluff fork servebest before months manufacturing date
rice,Patanjali Rozana Basmati Rice,https://www.patanjaliayurved.net/product/natural-food-products/rice/patanjali-rozana-basmati-rice/868,https://www.patanjaliayurved.net/assets/product_images/400x500/1689748132RozanaBasmatiRice1kg1.png,150,patanjali rozana basmati rice processed selected premium quality paddy procured foothills himalayas patanjali rice processed state art gmp plants ensure exquisite quality retention nutritive values effort ensure product reaches pristine conditionthese unique qualities coupled tempting taste patanjali super basmati rice delicacy world meal patanjali rice special tantalizing flavour magical aroma delicious fluffy texture,benefitsingredientshow useother product info light weight aromatic unique texture coupled tempting taste low cost compared brands aromatic fragrance nonsticky cooking long length quick cook soaked properly cooking grains double size wont break easy digestibility longer shelflife soft non sticky rice cookingbasmati rice oryza sativaopen pan boiling water open bowl add rice slowly gentle stirring cook minutes medium heat drain extra boiling waterclosed pan water rice pan tighten lid simmer minutes remove heat allow pan stand covered minutesmicrowave soaked rice add measured quantity water bowl stir select cooking option timings available oven remove oven let stand covered minutes serving  watt oven use g basmati rice timeautomatic electric rice cooker soaked rice cooker add measured quantity water switch cooker cooking cooker automatically switch cook mode warm mode allow rice steam mode servingbest before months manufacturing date
rice,Patanjali Diamond Basmati Rice,https://www.patanjaliayurved.net/product/natural-food-products/rice/patanjali-diamond-basmati-rice/3289,https://www.patanjaliayurved.net/assets/product_images/400x500/1689672044Diamond1121Rice-5kg1.png,845,patanjali brings worldrenowned indian basmati rice patanjali basmati rice processed select premium quality paddy procured foothills himalayas patanjali special basmati rice grains long slender grain elongates double original size cooking,benefitsingredientshow useother product infostrong aromaimproves nervous system healthgood source energyprevents obesitygood source proteindiamond basmati riceopen pan boil cups water add cup g rice stir occasionally cook uncovered medium heat min drain excess water pan fluff fork servepressure cooker boil half cups ml water add cup g rice stir occasionally cover pan tight lid allow steam min remove pan heat let cool min fluff fork servemicrowave place pre soaked rice one cup g soaked half cup waterml loosely microwaveable bowl cover cling film cook recommended remove bowl oven let stand min fluff fork servebest before months manufacturing date
rice,Patanjali Special Basmati Rice,https://www.patanjaliayurved.net/product/natural-food-products/rice/patanjali-special-basmati-rice/873,https://www.patanjaliayurved.net/assets/product_images/400x500/1689748030SpecialBasmatiRice1kg1.png,140,patanjali special basmati rice processed selected premium quality paddy procured foothills himalayas rice bowl states bharat like punjab haryana uttar pradesh madhya pradesh uttarakhand patanjali rice processed state art gmp plants ensure exquisite quality retention nutritive values effort ensure product reaches pristine condition patanjali special basmati rice grains long slender grains elongates double original size cooking unique qualities coupled tempting taste patanjali special basmati rice delicacy world meal patanjali rice special tantalizing flavour magical aroma delicious fluffy texture,benefitsingredientshow useother product info light weight aromatic unique texture coupled tempting taste low cost compared brands long grain aromatic fragrance nonsticky cooking soaked properly cooking grains double size wont break wont stick together high volume expansion cooking long length quick cook easy digestibility longer shelflifebasmati rice oryza sativaopen pan boiling water open bowl add rice slowly gentle stirring cook minutes medium heat drain extra boiling waterclosed pan water rice pan tighten lid simmer minutes remove heat allow pan stand covered minutesmicrowave soaked rice add measured quantity water bowl stir select cooking option timings available oven remove oven let stand covered minutes serving  watt oven use g basmati rice timeautomatic electric rice cooker soaked rice cooker add measured quantity water switch cooker cooking cooker automatically switch cook mode warm mode allow rice steam mode servingbest before months manufacturing date
rice,Patanjali Brown Basmati Rice Jar,https://www.patanjaliayurved.net/product/natural-food-products/rice/patanjali-brown-basmati-rice-jar/901,https://www.patanjaliayurved.net/assets/product_images/400x500/1689747959BrownBasmatiRiceJar1kg1.png,180,unique process produces brown basmati rice removes outermost layer hull rice kernel damaging nutritional value patanjali brown basmati rice highly famous great fragrance great taste,benefitsingredientshow useother product infostrong aromaimproves nervous system healthgood source energyprevents obesitygood source protein magnesiumlight weight foodbrown riceopen pan bring water rolling boil add rice stir gently cook uncovered medium heat till rice drain extra waterclose pan bring water boil cover pan lid let simmer minutes remove heat let stand minutes servingmicro waveput soaked rice water bowl stir covered pierce cling film let stand covered minutes remove oven let stand covered for minutes serving watt microwave oven grams rice timeelectric cookerput soaked rice cooker add measured water switch cooker cooker automatically switch cook keep warm mode allow rice tosteam warm mode servingbest months packaging
rice,Patanjali Dhanshree Basmati Rice,https://www.patanjaliayurved.net/product/natural-food-products/rice/patanjali-dhanshree-basmati-rice/871,https://www.patanjaliayurved.net/assets/product_images/400x500/1689748070DhanshreeBasmatiRice1kg1.png,170,patanjali dhanashree basmati rice processed selected premium quality paddy procured rice bowl states bharat like punjab haryana uttar pradesh madhya pradesh uttarakhand patanjali rice processed stateoftheart gmp plants ensure exquisite quality retention nutritive values effort ensure product reaches pristine condition patanjali dhanashree basmati rice grains long slender grain elongates double originalsize cooking unique qualities coupled tempting taste patanjali basmati rice delicacy world meal patanjali rice special tantalizing flavour magical aroma delicious fluffy texture,benefitsingredientshow useother product info light weight aromatic unique texture coupled tempting taste low cost compared brands high volume expansion cooking long length quick cook easy digestibility longer shelflife biryani fried rice aromatic fragrance nonsticky cooking soft non sticky rice cookingbasmati rice oryza sativaopen pan boiling water open bowl add rice slowly gentle stirring cook minutes medium heat drain extra boiling waterclose pan water rice pan tighten lid simmer minutes remove heat allow pan stand covered minutesmicrowave soaked rice add measured quantity water bowl stir select cooking option timings available oven remove oven let stand covered minutes serving  watt oven use g basmati rice timeautomatic electric rice cooker soaked rice cooker add measured quantity water switch cooker cooking cooker automatically switch cook mode warm mode allow rice steam mode servingbest before months manufacturing date
rice,Patanjali Samriddhi Basmati Rice,https://www.patanjaliayurved.net/product/natural-food-products/rice/patanjali-samriddhi-basmati-rice/1331,https://www.patanjaliayurved.net/assets/product_images/400x500/1689675690SamridhiRice5kg1.png,845,patanjali samridhhi basmati rice processed select premium quality paddy procured foothills himalayas patanjali samridhhi basmati rice grains long slender grain elongates double original size cooking,benefitsingredientshow useother product info rich aroma unique texture authentic flavorbasmati ricefor best results soak patanjali sampoorn basmati rice water min cookingput boiling water open bowladd rice slowly gentle stirring cook minutes medium heatdrain extra boiling waterbest before months manufacturing date
rice,Patanjali Royal Sona Masoori Rice,https://www.patanjaliayurved.net/product/natural-food-products/rice/patanjali-royal-sona-masoori-rice/1287,https://www.patanjaliayurved.net/assets/product_images/400x500/16896764151.png,128,patanjali royal sona masoori rice processed selected premium qualitypaddy procured rich belt telangana produces best quality royal sona masoori crop patanjali royal sona masoori rice processed state art plants ensure exquisite quality retention nutritive values effort ensure product reaches pristine condition patanjali royal sona masoori rice light weight aromatic completes search perfect rice patanjali royal sona masoori rice ideal rice sweet pongal biryani idlis fried rice,benefitsingredientshow useother product info rich aroma unique texture authentic flavorbasmati riceopen pan bring water rolling boil add rice stir gently cook uncovered medium heat till rice drain extra waterclose pan bring water boil cover pan lid let simmer minutes remove heat let stand minutes servingmicro wave soaked rice water bowl stir covered pierce cling film let stand covered minutes remove oven let stand covered minutes serving watt microwave oven grams rice timeelectric cooker soaked rice cooker add measured water switch cooker cooker automatically switch cook keep warm mode allow rice steam warm mode servingbest before months manufacturing date
rice,Patanjali Shakti Xxl Basmati Rice,https://www.patanjaliayurved.net/product/natural-food-products/rice/patanjali-shakti-xxl-basmati-rice/869,https://www.patanjaliayurved.net/assets/product_images/400x500/1689748103ShaktiXXLBasmatiRice1kg1-Copy.png,165,patanjali shakti rice xxl processed select premium quality paddy procured foothills himalayas patanjali grains long slender grain elongates double original size cooking,benefitsingredientshow useother product info delicious unique texture aroma soaked properly cooking grains double size wont break wont stick together low cost compared brands biryani fried rice high volume expansion cooking easy digestibility longer shelflife aromatic fragrance nonsticky cooking excessive elongation cooking soft fluffy texture cooked ricebasmati rice oryza sativafor best results soak patanjali basmati rice water min cooking boiling water open bowl add rice slowly gentle stirring cook minutes medium heat drain extra boiling waterbest before months manufacturing date
