poduct_category,Product Name,Link,Image,Price,product_description,tab_discription
pooja-essentials,Aastha Tamrakanti Shining Powder,https://www.patanjaliayurved.net/product/herbal-home-care/pooja-essentials/aastha-tamrakanti-shining-powder/4022,https://www.patanjaliayurved.net/assets/product_images/400x500/1698912155Tamrakantishiningpowder150g1.png,40,patanjali aastha tamrakanti shining powder effectively cleans metals copper brass aluminium iron steel remarkable powder effortlessly eliminates stains metal surface providing enduring outcomes patanjali aastha tamrakanti shining powder formulated unique cleaning agent effortlessly removes oiliness stains leaving metal surfaces brilliant shine gloss gentle hands,benefitshow useother product infoit easily removes stains metalskin friendlywet articleclean new tamrakanti shining powderwash wipe dryuse scrubber aluminium steel iron utensilsbest years date manufacturing
pooja-essentials,Aastha Gugal,https://www.patanjaliayurved.net/product/herbal-home-care/pooja-essentials/aastha-gugal/4124,https://www.patanjaliayurved.net/assets/product_images/400x500/1701406974AasthaGugal1.png,120,patanjali aastha pooja products best quality ingredients aimed creating divine atmosphere,benefitsingredientshow uselasting aromamakes pleasant environment surroundinggugal gently remove piece gugal packet pour gugal burning charcoal incense burner
pooja-essentials,Aastha Cow Ghee,https://www.patanjaliayurved.net/product/herbal-home-care/pooja-essentials/aastha-cow-ghee/1528,https://www.patanjaliayurved.net/assets/product_images/400x500/1688793287AasthaGhee200g1.png,150,aastha pure cows desi ghee makes worship meaningful fragrance purity gives power satvik energy worship increases taste food,benefitsingredientshow useother product infopatanjali cow ghee  purefull nutritive properties ideal dietcow ghee increases memory intellectits purity gives power satvik energy worshipmilk fat cows milkuse diya hawan yagyabest before months manufacturing date
pooja-essentials,Aastha Gulal 100 Gm Mix (Rypo),https://www.patanjaliayurved.net/product/herbal-home-care/pooja-essentials/aastha-gulal-100-gm-mix-rypo/3473,https://www.patanjaliayurved.net/assets/product_images/400x500/1617618123400x500.jpg,30,patanjalis naturalgulalis premium quality nontoxic ingredients soft silky feeling applied body ecofriendly product adds rich colour festive occasions,benefitsingredientshow useother product infoskin friendlynontoxicstarchfood gradedo throw eyesfor external use onlybest days manufacturing date
dishwash-bar-and-gel,Patanjali Super Dish wash Bar-225 Gram B3G1 Free,https://www.patanjaliayurved.net/product/herbal-home-care/dishwash-bar-and-gel/patanjali-super-dish-wash-bar-225-gram-b3g1-free/3940,https://www.patanjaliayurved.net/assets/product_images/400x500/1688706199SuperDishwash225gB3G11.png,67,lemon combined wood ash naturally acts superior cleansing disinfecting agent organic product nontoxic natural ingredients soap doesnt contain artificial additives like colors fragrances enzymes bleaches harmful chemicals ideal types dishes including ceramic nonstick ware,benefitsingredientsother product infoit act natural superior cleaning agent disinfectantsoda ash lightsodium carbonatelabsadodecylbenzene sulfonic acidlemon peel oil citrus limonneem extract azadirachta indicawood ashbest years date manufacturing
dishwash-bar-and-gel,Patanjali Super Dish Wash Gel Lemon Power,https://www.patanjaliayurved.net/product/herbal-home-care/dishwash-bar-and-gel/patanjali-super-dish-wash-gel-lemon-power/4113,https://www.patanjaliayurved.net/assets/product_images/400x500/1700197140superdishwashgel250ml1.png,46,patanjali super dish wash gel lemon power powerful efficient solution dishwashing needs enriched power lemon cleanses oil tough stains kills  germs utensils provides safety shield familypatanjali super dish wash gel specially formulated refreshing scent lemon leaving dishes smelling clean fresh advanced formula cuts grease stubborn food stains ensuring sparkling clean dishes time gentle effective formula safe use types dishes including glassware,benefitsingredientshow useother product infoit act natural superior cleaning agent disinfectantaquasodium laureth sulfatedodycyllbenzene sulfonic acidsodium hydroxidecocamidopropyl betainedmdm hydantoin and lodopropynyl butycarbamatehydroxydichlorodiphyenyl etheracrylic acid polymercitrus limon peel oilcitric acidfragnance ci pull tip cap unlock usepour ml gel bowlmix ml watersoak gel scrubber spongeswiperub scrubber sponge till clean rinse offpress tip cap lock usebest months date manufacturing
dishwash-bar-and-gel,Dishwash Bar-600g (500g+100g)+ Scrub Pad,https://www.patanjaliayurved.net/product/herbal-home-care/dishwash-bar-and-gel/dishwash-bar-600g-500g100g-scrub-pad/3992,https://www.patanjaliayurved.net/assets/product_images/400x500/1701407236superdishwash600g1.png,58,lemon combined wood ash naturally acts superior cleansing disinfecting agent organic product nontoxic  natural ingredients soap doesnt contain artificial additives like colors fragrances enzymes bleaches harmful chemicals ideal types dishes including ceramic nonstick ware,benefitsingredientsit act natural superior cleaning agent disinfectantsoda ash light sodium carbonatelabsa dodecylbenzene sulfonic acidlemon peel oil citrus limonneem extract azadirachta indicawood ash
dishwash-bar-and-gel,Patanjali Super Steel Scrub With Scrub Pad,https://www.patanjaliayurved.net/product/herbal-home-care/dishwash-bar-and-gel/patanjali-super-steel-scrub-with-scrub-pad/1128,https://www.patanjaliayurved.net/assets/product_images/400x500/1688705331StainlessSTEELScrub1.png,18,patanjali super steel scrub finest grade stainless steel patanjali scrub pad uniform coating alo helps quick superior helps remove dirt greasy materials utensils,benefitsingredientshow useother product infonon rustlong lastingsoft handstough stains grade stainless steelfor better result use patanjali super dish wash bar gelbest years manufacturing date
dishwash-bar-and-gel,Patanjali Super Steel Scrub,https://www.patanjaliayurved.net/product/herbal-home-care/dishwash-bar-and-gel/patanjali-super-steel-scrub/1124,https://www.patanjaliayurved.net/assets/product_images/400x500/1688705545f.png,9,patanjali super steel scrub finest grade stainless steel,benefitsingredientsother product infonon rust long lasting soft hands tough stains grade stainless steelbest before months manufacturing date
dishwash-bar-and-gel,Patanjali Super Dish Wash Bar,https://www.patanjaliayurved.net/product/herbal-home-care/dishwash-bar-and-gel/patanjali-super-dish-wash-bar/3905,https://www.patanjaliayurved.net/assets/product_images/400x500/17001969091.png,5,lemon combined wood ash naturally acts superior cleansing disinfecting agent organic product nontoxic natural ingredients soap doesnt contain artificial additives like colors fragrances enzymes bleaches harmful chemicals ideal types dishes including ceramic nonstick ware,benefitsingredientshow useother product infoit act natural superior cleaning agent disinfectantsoda ash light sodium carbonatelabsa dodecylbenzene sulfonic acidlemon peel oil citrus limonneem extract azadirachta indicawood ashwet sponge cloth scrubber rub soap circular motion create rich sudsbest years date manufacturing
dishwash-bar-and-gel,Patanjali Super Dish Wash Gel Rakh & Lemon,https://www.patanjaliayurved.net/product/herbal-home-care/dishwash-bar-and-gel/patanjali-super-dish-wash-gel-rakh-lemon/3538,https://www.patanjaliayurved.net/assets/product_images/400x500/1697699428SuperDishwashgelwithrakhandlemon250ml1.png,50,patanjali super dish wash gel rakh lemon powerful efficient solution dishwashing needs enriched power lemon cleanses oil tough stains kills  germs utensils provides safety shield familyrakh wood ash natural abrasive clean metal objects glasspatanjali super dish wash gel specially formulated refreshing scent lemon leaving dishes smelling clean fresh advanced formula cuts grease stubborn food stains ensuring sparkling clean dishes time gentle effective formula safe use types dishes including glassware,benefitsingredientshow useother product infoit act natural superior cleaning agent disinfectantnovethix hc labsadodecylbenzene sulfonic acidrakhwood ashlemon peel oilcitrus limonremove locking clippress lid pumpo gel lid requiredsoak gel scrubuse scrub dirty utensils wash better resultbest year manufacturing date
face-wash,Patanjali Saundarya Neem-tulsi Face Wash,https://www.patanjaliayurved.net/product/natural-personal-care/skin-care/face-wash/patanjali-saundarya-neem-tulsi-face-wash/1123,https://www.patanjaliayurved.net/assets/product_images/400x500/1689485913NeemTulsiFacewash100g1.png,86,patanjali neemtulsi face wash soapfree herbal formulation gently cleanse moisturize face antibacterial properties neem tulsi blend hydrating rejuvenating effects aloe vera cleanse skin grime dirt pollutants let breathe easy day skin feels fresh long mediumthick gel lathers smoothly leaves residue works disinfectant heals pimples acne rashes neemtulsi face wash rich natural ingredients free harmful chemicals available travelfriendly pack use daily cleanser help skin stay moisturized oily good skin types,benefitsingredientshow useother product infogently cleanse moisturize facethe skin feels fresh long timeworks disinfectant heals pimples acne rashesrich natural ingredientsfree harmful chemicalsaloeveraneemtulsibase materialaquagel basevitamin ehoneydimethiconepermitted colour ci sugandhit dravya qsapply wet face massage gently minute water wash waterbest before months manufacturing date
face-wash,Patanjali Saundarya Face Wash,https://www.patanjaliayurved.net/product/natural-personal-care/skin-care/face-wash/patanjali-saundarya-face-wash/665,https://www.patanjaliayurved.net/assets/product_images/400x500/1689486362SaundaryaFacewash60g1(1).png,63,patanjali saundarya facewash herbal face wash natural ingredients effective solution daily skincare routine face wash deeply cleanses purifies skinthe herbal formula enriched botanical extracts known soothing nourishing properties promoting healthy complexion major ingredients facewash include neem tulsi aloevera orange peel suitable skin types face wash gently removes impurities excess oil makeup stripping skin natural moisture,benefitsingredientshow useother product infocan treating skin ailments including acne aging signsit reduce acne eruptions skin clean clearit help reduce wrinkles age spots fine lines faceit rejuvenates revitalizes skin makes appears younger natural glowit cleanses face removes dirt dustaloe vera ghrit kumariorange peel citrus reticulataneem azadirachta indicatulsi ocimum sanctumbase material aquamyristic acidglycerinepropylene glycolstearic aciddecyl glucosidelauric acidglyceryl monostearateniacinamidetocopheryl acelateretinyl palmilatepeg mhoneypearlethyl hexyl glycerine phenoxyl ethanol undecylenatesugandhit dravya qsapply circular motion facecover parts facewash waterbest before months manufacturing date
face-wash,Patanjali Aloevera Gel Face Wash,https://www.patanjaliayurved.net/product/natural-personal-care/skin-care/face-wash/patanjali-aloevera-gel-face-wash/3866,https://www.patanjaliayurved.net/assets/product_images/400x500/16894853301.png,63,patanjali aloevera gel face wash mild foaming face wash sensitive skin refreshing nourishing skincare solution aloevera mint patanjali aloevera gel facewash boosts skin hydration prevents acne complexion smooth clear radiantthe natural properties aloe vera help soothe calm skin reducing redness irritation suitable skin types facewash effectively removes dirt oil impurities maintaining skins natural moisture balance,benefitsingredientshow useother product inforejuvenates skinhelps boost skin hydrationprevents acnekeeps complexion smooth clear radiantremoves impurities dirtaloevera aloe barbadensispudina mentha spicatabase materialaquaglycerindecyle glucosidepropylene glycolglycerin glyceyl glucosidesugandhit dravyacarbomervit eedta disodium phenoxyethanolchlorphenesinethylhexyglycerinsodium benzoate qsapply ml moisten face massage gently circular motion wash waterbest months date manufacturing
face-wash,Patanjali Neem Tulsi Face Wash,https://www.patanjaliayurved.net/product/natural-personal-care/skin-care/face-wash/patanjali-neem-tulsi-face-wash/661,https://www.patanjaliayurved.net/assets/product_images/400x500/16894864551.png,54,patanjali neemtulsi face wash soapfree herbal formulation gently cleanse moisturize face antibacterial properties neem tulsi blend hydrating rejuvenating effects aloe vera cleanse skin grime dirt pollutants let breathe easy day skin feels fresh long mediumthick gel lathers smoothly leaves residue works disinfectant heals pimples acne rashes neemtulsi face wash rich natural ingredients free harmful chemicals available travelfriendly pack use daily cleanser help skin stay moisturized oily good skin types,benefitsingredientshow useother product infohelps spots pimplesremoves deep impuritiesrefreshes skinaloe veraneemtulsibase material aquagel basevitamin ehoney sugandhit dravya qsdiazolidinyl urea ipbcpermitted colour ci apply wet facemassage gently minute waterwash waterin case contact eyes rinse water immediatelybest months manufacturing date
face-wash,Patanjali Rose Face Wash,https://www.patanjaliayurved.net/product/natural-personal-care/skin-care/face-wash/patanjali-rose-face-wash/663,https://www.patanjaliayurved.net/assets/product_images/400x500/1689486394RoseFacewash60g1.png,50,patanjali rose facewash gentle refreshing cleanser makes skin rejuvenated revitalized natural extracts rose neem aloe vera patanjali rose face wash gently cleanses nourishes revitalizes dull skin tissue fresh smooth soft lookpatanjali rose facewash useful healing dryness roughness skin reducing pimples major ingredients patanjali rose facewash include ghrit kumari neem aqua honey mild formula suitable skin types including sensitive skin effectively removes dirt oil impurities stripping away natural moisture,benefitsingredientshow useother product inforeduces pimplesmakes complexion smoother freshreduces dryness roughnessghrit kumari aloe barbadensisrose rosa centifolianeem azadirachta indicaaquagel basehoneyvitamin ecolour cl  diazolidinyl urea ipbcsugandhit dravyaapply wet facemassage gently minutewash water best before months manufacturing date
face-wash,Patanjali Lemon Honey Face Wash,https://www.patanjaliayurved.net/product/natural-personal-care/skin-care/face-wash/patanjali-lemon-honey-face-wash/660,https://www.patanjaliayurved.net/assets/product_images/400x500/1689486490LemonHoneyFacewash60g1.png,50,patanjali lemon honey herbal face wash soapfree herbal formulation contains lemon honey major ingredients facewash aloe vera neem tulsi patanjali lemon honey face wash gently cleanses rejuvenates skinthe natural antibacterial properties lemon help combat acne blemishes honey moisturizes soothes leaving skin feeling soft supple suitable skin types patanjali lemon honey facewash effectively removes dirt oil impurities unclogging pores promoting healthy complexion,benefitsingredientshow useother product infonatural cleansersoapfree washdeep cleansescontrols excess oil productionmoisturizes rejuvenates skin tissuepure honeyaloe veralemon peelneemtulsibase material aquagel basediazolidinyl urea ipbcvitamin ecolour ci   sugandhit dravya qsapply wet face massage gently minute wash waterin case contact eyes rinse water immediatelybest before months manufacturing date
face-wash,Patanjali Honey Orange Face Wash,https://www.patanjaliayurved.net/product/natural-personal-care/skin-care/face-wash/patanjali-honey-orange-face-wash/659,https://www.patanjaliayurved.net/assets/product_images/400x500/1689486522HoneyOrangeFacewash60g1.png,50,patanjali honey orange herbal face wash formulated honey orange extracts gently cleanses rejuvenates skin ingredients like aloevera honey orange peel tulsi neem haldi mulethi refreshing nourishing addition skincare routinea  soapfree deepcleansing gel specially formulated oily sensitive acneprone skin neem tulsi turmeric natural antiseptics remove impurities act disinfectant prevent pimples acne forming mulethi adds freshness skin aloe vera honey skin soft smooth glowing,benefitsingredientshow useother product infonatural cleansersoapfree washdeep cleansescontrols excess oil productionprevents acne formingmoisturizes rejuvenates skin tissuealoeverahoneyorange peeltulsineemhaldimulethibase material aquagel basecolour ci methylisothiazoline andpotassium sorbatesugandhit dravyaapply wet facemassage gently minutewash waterin case contact eyes rinse water immediatelybest before months manufacturing date
face-wash,Patanjali Orange Aloevera Face Wash,https://www.patanjaliayurved.net/product/natural-personal-care/skin-care/face-wash/patanjali-orange-aloevera-face-wash/662,https://www.patanjaliayurved.net/assets/product_images/400x500/1689486427OrangeAloeveraFacewash60g(2).png,50,patanjali orange aloe vera herbal face wash unique combination nourishing aloe vera natural astringent orange peel facewash deeply cleanses nourishes skin natural antioxidants oranges help brighten rejuvenate complexion aloe vera soothes hydrates leaving skin feeling refreshed revitalized aloe veras natural moisturizing properties skin softneem tulsi add disinfectant healing touch face wash gently cleansing face suitable skin types facewash effectively removes dirt oil impurities unclogging pores preventing breakouts,benefitsingredientshow useother product infogentle cleanserrejuvenates dehydrated skindisinfects cleansingghrit kumari aloeveraorange peel citrus sinensisneem azadirachta indicatulsi ocimum sanctumbase materialsaquasoft soap basediazolidinyl urea ipbcvitamin esugandhit dravya qsapply wet face massage gently minute wash waterbest before months manufacturing date
face-wash,Patanjali Saundarya Aloe Vera Gel,https://www.patanjaliayurved.net/product/natural-personal-care/skin-care/face-wash/patanjali-saundarya-aloe-vera-gel/545,https://www.patanjaliayurved.net/assets/product_images/400x500/1700202042aloeveragel150ml1.png,96,patanjali saundarya aloevera gel instant solution pimples wrinkles glowing fair skin primary ingredient gel aloevera proven possess strong healing properties soothe damaged skin enhance repair process treating skin ailments including acne burns wounds sun damage,benefitsingredientshow useother product infodermatologically testeduseful rejuvenating nourishing beautifying skinalso use anti tan packuseful dryness roughness skinuseful dandruff hair fall solutionan instant solution pimples wrinkles glowing skinremoves dark spots increases skin glowghrit kumari swaras aloe bardadensisbase materialsvitamin epermitted colour sugandhit dravya qs pimples wrinkles  massage face aloevera gel leave night wash lukewarm water morning apply aloevera gel face minutes bath roughness blemishes  massage aloevera gel minutes hair problems massage aloevera gel minutes bathbest before months manufacturing date
face-wash,Men's Charcoal Active Face Wash,https://www.patanjaliayurved.net/product/natural-personal-care/skin-care/face-wash/mens-charcoal-active-face-wash/3763,https://www.patanjaliayurved.net/assets/product_images/400x500/1689485520MensCharcoal100g1.png,92,patanjali charcoal active facewash powerful cleansing solution designed deeply purify revitalize skin infused combination activated charcoal natural bio actives vitamins remove dirt oil dead skin cells pollution cleanse deeply pores detoxify skin complexion refreshed radiantpatanjali charcoal active facewash helps unclog pores reduce blackheads prevent breakouts making suitable skin types enriched natural ingredients facewash provides nourishment hydration leaving skin looking healthy radiant,benefitsingredientshow useother product infodermatologically safe testedcleanse deeply pores detoxify skin complexion refreshed radiantremove pollution toxins dirt excess oil sebum dead skin cellsulphate freephthalates freeparabens freealoe vera aloe barbandesis mgpudina mentha piperita mgturmeric oil curcuma longa mgneem azadirachta indica mgtulsi ocimum sanctum mgbase material aquaglycerinvegetable fatty acidsactivated charcoalpropylene glycol distearatepotassium hydroxidedecyl glucosideglyceryl stearatepolyquatemiumvit e honeyyashad bhasmadiazolidinyl urea ipbcsugandhit dravyaqsapply wet face massage gently minute wash water case contact eyes rinse thoroughly waterbest months date manufacturing
face-wash,Men's Beard Entice Face Wash,https://www.patanjaliayurved.net/product/natural-personal-care/skin-care/face-wash/mens-beard-entice-face-wash/3765,https://www.patanjaliayurved.net/assets/product_images/400x500/16894854231.png,88,patanjali mens beard entice face wash enriched fresh cooling splashes menthol conditioning hydration property aloe vera water melon cleanse gently beard conditioned itch free smooth refreshed skin provide entice look,benefitsingredientshow useother product infodermatologically testedcleanse gently remove dandruffprovide entice look conditioning soothing refreshing beard face bothphthalates freeparabens freealoevera aloe barbadensis mgpudina mentha piperita mgwatermelon citrullus colocynthis mgbhringraj eclipta alba mgchina rose  hibiscus rosasinensis mgbase material aquasorbitolvegetable fatty acidstriethanolaminepropanedioldiazolidinyl urea ipbcci sugandhit dravyaqsapply wet face massage gently minute wash water case contact eyes rinse thoroughly waterbest months date ofmanufacturing
face-wash,Men's Energy Active Face Wash,https://www.patanjaliayurved.net/product/natural-personal-care/skin-care/face-wash/mens-energy-active-face-wash/3764,https://www.patanjaliayurved.net/assets/product_images/400x500/1689485469MensEnergyActive100g1.png,88,patanjali mens energy active face wash specially formulated men infused natural ingredients including aloevera coffee pudina anar chhilka lemon grape seed oil patanjali energy active facewash helps invigorate skin gentle formula effectively cleanses skin removing dirt oil impurities stripping away essential moisturesuitable skin types facewash free harsh chemicals dermatologisttested safety effectiveness patanjali energy active facewash perfect solution want start day feeling refreshed energizeduse daily achieve healthy glowing complexion radiates energy vitality,benefitsingredientshow useother product infodermatologically testedit cleanse gently remove excess oil dirtmake completion fresh smooth energetichelps control blemishes pimplesphthalates freeparabens freealoevera aloe barbadensis mgcoffee coffea arabica mgpudina mentha piperita mganar chhilka punica granatum mglemon citrus limon  mggrape seed oil vitis vinifera mgbase materialaquacorn coconut base surfactantolive oil esterdecyl glucosidesaccharide isomeratesorbitolsodium hydroxidepropenediol vite vit choneyethylhexyglycerin phenoxyethanol andundecylenate ci sugandhit dravyaqsapply wet face massage gently minute wash waterbest months date manufacturing
face-wash,Patanjali Saundarya Aloe Vera Gel Kesar Chandan,https://www.patanjaliayurved.net/product/natural-personal-care/skin-care/face-wash/patanjali-saundarya-aloe-vera-gel-kesar-chandan/547,https://www.patanjaliayurved.net/assets/product_images/400x500/1689486554SaundarayAloeveragelkesarchandan60ml1.png,58,patanjali saundarya aloevera keasr chandan gel instant solution pimples wrinkles glowing fair skin primary ingredient gel aloevera proven possess strong healing properties,benefitsingredientshow useother product infodermatalogically testedan instant solution pimples wrinkles glowing skinremove dark spots increases skin glowgrit kumari aloe barbadensiskesar crocus sativussafed chandan santalum albumbase materialvitamin epermitted colour sugandhit dravya qsuse twice day morning bath evening bedtimeapply affected area skinbest before months manufacturing date
face-wash,"Patanjali Saundarya Face Wash (Aloevera, Neem, Tulsi, Orange Peel)",https://www.patanjaliayurved.net/product/natural-personal-care/skin-care/face-wash/patanjali-saundarya-face-wash-aloevera-neem-tulsi-orange-peel/1005,https://www.patanjaliayurved.net/assets/product_images/400x500/1689486013Saundrayfacewashorangepeel100gm1.png,95,saundraya face wash rich nourishing healing rejuvenating properties aloe vera face wash gently removes dirt grime deep cleanses drying skin orange peel extracts combined mix leaves skin youthful firmer neem tulsi cleanse disinfect tighten skin clean smooth look use twice daily required face clean bright,benefitsingredientshow useother product infopatanjali saundarya face wash treating skin ailments including acne aging signsit reduce acne eruptions skin clean clearit help reduce wrinkles age spots fine lines faceit rejuvenates revitalizes skin makes appears younger natural glowit cleanses face removes dirt dustorange peelcitrus reticulateneem azadirachta indicatulsiocimum sanctumaloe barbadensis aloe verabase material aqua soft soap base vitamin vitamin e honey sugandhit dravyaapply wet face massage gently minute water wash water avoid eye contactbest before months manufacturing date
