poduct_category,Product Name,Link,Image,Price,product_description,tab_discription
churna,Divya Kutki Churna,https://www.patanjaliayurved.net/product/ayurvedic-medicine/churna/divya-kutki-churna/87,https://www.patanjaliayurved.net/assets/product_images/400x500/1688373525KutkiChurna1.png,150,kutki churna ayurvedic medicine fortifies liver hepatitis c virus protects heart boosts immunity multiple benefits improves digestion helps controlling weight helps recover jaundice,benefitsingredientshow useother product infoheals liver heart problemsimproves digestionkutkias directed physicianbest before months manufacturing date
churna,Divya Baheda Churna,https://www.patanjaliayurved.net/product/ayurvedic-medicine/churna/divya-baheda-churna/25,https://www.patanjaliayurved.net/assets/product_images/400x500/1688380199BehadaChurma10g1.png,10,baheda churna extracts baheda multifarious benefits cures cough congestion laryngitis cures stomach ailments improves vision baheda natural source vitamins cures cold infections strengthens vision purges stomach controlling indigestion constipation baheda churna immediate relief longlingering cold throat ache experience goodness ayurvedic cure baheda churna,benefitsingredientshow useother product infouseful cough throat diseases laryngitis etcbahedaas directed physicianbest before months manufacturing date
churna,Divya Brahmi Churna,https://www.patanjaliayurved.net/product/ayurvedic-medicine/churna/divya-brahmi-churna/29,https://www.patanjaliayurved.net/assets/product_images/400x500/1688380073Brahmichuran100g1.png,40,brahmi churna brings goodness brahmi extracted care precision time immemorial brahmi brain tonic soothes nourishes cerebellum promoting memory intellectual ability calms mind improves concentration brahmi churna cooling effect body mind relieving headaches facilitating sleep relax body mind lasting relief brahmi churna,benefitsingredientshow useother product infouseful smriti bhranshaboosts memory powerbrahmias directed physicianbest days manufacturing date
churna,Divya Gashar Churna,https://www.patanjaliayurved.net/product/ayurvedic-medicine/churna/divya-gashar-churna/44,https://www.patanjaliayurved.net/assets/product_images/400x500/1688379851GasharChurna100g1.png,105,divya gashar churna effective digestive medicine aids digestion stimulates digestive enzymes heals digestion disorders naturally accumulation gas leads headache discomfort churna combination herbal powders antacid properties soothes acidity suppresses restlessness gas divya gashar churna fortifies digestive tract increases appetite dont let acidity heartburn hold enjoying good life divya gashar churna experience longlasting ayurvedic healing,benefitsingredientshow useother product infouseful indigestion constipation abdominal disorders gastric discomfortajawainkali mirchkala namakchotiharadmeetha sodanausadarheeng shudhnimbusatvajeeraas directed physicianbest before months manufacturing date
churna,Divya Rasna Churna,https://www.patanjaliayurved.net/product/ayurvedic-medicine/churna/divya-rasna-churna/2934,https://www.patanjaliayurved.net/assets/product_images/400x500/1689506282Rasnachurna50g1.png,25,divya rasna churna contains rasna pluchea lacneolata main ingredient natural cure problems nervous system,benefitsingredientshow useother product infohelps conditions like neuritis sciatica chronic inflammation nervous systemused treat rheumatoid arthritis vata disordersuseful health problems related female genital system like amenorrhoea dysmenorrhoeaacts antipyreticuseful skin diseases like itching eczemaspecific action delay sign agingrasna pluchea lacneolata gram twice daily milk directed physicianbest months manufacturing date
churna,Divya Vatari Churna,https://www.patanjaliayurved.net/product/ayurvedic-medicine/churna/divya-vatari-churna/211,https://www.patanjaliayurved.net/assets/product_images/400x500/1688365933Vatarichuran1.png,105,churna consists dry ginger picrorhiza kurroa kutki fenugreek ashwagandha suranjana sweet best treatment gastric problems aamvat gases collect stomach causing pains joints diseases powder beneficial different herbs materials ayurveda importance refined form powder base salt acid mixed powder warm nature digestible tasteful ignites hunger sugar candy mixed powders rich purgation quality cool bile suppressive powders formed bitter items treat fever phlegm medicines prepared herbs finely grinned dried called churna ayurveda,benefitsingredientshow useother product infoit useful vata diseases gout rheumatism joint pains body pain disordersit alleviates vitiated vata useful rheumatoid arthritis scitica lumbago waist painshunthiashwagandhasurjanamethikutaki etchalf spoon near grams stomach meals according disease morning evening tepid wateror directed physicianbest before months manufacturing date
churna,Divya Youvan Churna,https://www.patanjaliayurved.net/product/ayurvedic-medicine/churna/divya-youvan-churna/222,https://www.patanjaliayurved.net/assets/product_images/400x500/1688365622YouvanChurna100g1.png,250,patanjali divya youvan churna ayurvedic medicine primarily treatment weakness erectile dysfunction ingredients patanjali youvan churna ashwagandha eucalyptus vang bhasma jahar mohra bhasma behman safed butea monosperma,benefitsingredientshow useother product infoit treat oligospermia syndrome disorder improving sperm count quality enhances testosterone secretion body helps enhancing reproduction process sexual strength help stimulate reproductive function brain cells increase chances fertility naturallyit nourishes body highquality minerals vitamins improve functions health bodyslow process agingimprove libido strengthens veinscontrol balance blood pressureacidity intestine tract problemssalam panjasalam mishrimishrisafed mooslikshirakakoliashwagandhagond katirapalashabahman safedjaharmohra bhasmalohbanbabool gondglucosebooraone teaspoonful twice daily lukewarm milk directed physicianbest days manufacturing date
churna,Divya Bakuchi Churna,https://www.patanjaliayurved.net/product/ayurvedic-medicine/churna/divya-bakuchi-churna/26,https://www.patanjaliayurved.net/assets/product_images/400x500/1688380167BakuchiChurna50g1.png,30,bakuchi churna cures skin disorders controls leucoderma vitiligo bakuchi churna brings goodness bakuchi seeds extracted extreme care bakuchi potent seed acts blood purifier controls cures damages skin bakuchi churna natural extracts effects dont troubled skin disorders bakuchi churna cleanse blood toxins microorganisms healthy glowing skin,benefitsingredientshow useother product infouseful vitiligo leucoderma skin diseasesbakuchi seedsas directed physicianbest before months manufacturing date
churna,Divya Bilwadi Churna,https://www.patanjaliayurved.net/product/ayurvedic-medicine/churna/divya-bilwadi-churna/28,https://www.patanjaliayurved.net/assets/product_images/400x500/1688380118BilwadiChurna100g1.png,55,bilwadi churna cures upset stomach diarrhea dysentery herbal properties eliminate harmful microorganisms digestive tract facilitates normal absorption nutrients intestines stimulates digestive enzymes aid digestion bilwadi churna cooling effect stomach eases abdominal pain discomfort immediately natural extracts effects bilwadi churna combines goodness bel herbs boost digestive system holistic cure digestive disorders bilwadi churna,benefitsingredientshow useother product infouseful diarrhea dysenterybilwadi churna cooling effect stomach eases abdominal pain discomfort immediatelyno effectsbel girimochrassounthdhai phooldhaniasounfsabj patraas directed physicianbest before months manufacturing date
churna,Divya Mulethi Churna,https://www.patanjaliayurved.net/product/ayurvedic-medicine/churna/divya-mulethi-churna/126,https://www.patanjaliayurved.net/assets/product_images/400x500/1688369069mulethichuran1.png,55,divya mulethi churna ayurvedic product patanjali ayurved divya pharmacy mulethi churna useful acidity flatulence hyper acidity cough cold,benefitsingredientshow useother product infotreat respiratory problemsobesityskin infectionliver disordersgastric problemhormonal regulationgeneral debilityjoint painmulethi powderglycyrrhiza glabra g powder twice thrice daily stomach lukewarm water milk directed physicianbest before months manufacturing date
churna,Divya Pippali Churna,https://www.patanjaliayurved.net/product/ayurvedic-medicine/churna/divya-pippali-churna/138,https://www.patanjaliayurved.net/assets/product_images/400x500/1688368535pepalichuran1.png,170,pippali valued ayurvedic food supplements enhancing digestion metabolism considered rejuvenator lungs helps relax blood vessels increases circulation specially lungs combined dried ginger black pepper form trikatu taken regulate cholesterol helps control obesity,benefitsingredientshow useother product infouseful kaas swas jwar etcpippalias directed physicianbest before months manufacturing date
churna,Divya Shuddhi Churna,https://www.patanjaliayurved.net/product/ayurvedic-medicine/churna/divya-shuddhi-churna/1189,https://www.patanjaliayurved.net/assets/product_images/400x500/1688365384ShuddhiChurna100g1.png,105,divya shuddhi churna ayurvedic medicine primarily treatment indigestion useful constipation flatulence loss appetite etc,benefitsingredientshow useother product infouseful constipation indigestion flatulenceharadbahedabhumi amlatankan bhasmjeerahingindrayanas directed physicianbest before months manufacturing date
churna,Divya Shunthi Churna,https://www.patanjaliayurved.net/product/ayurvedic-medicine/churna/divya-shunthi-churna/164,https://www.patanjaliayurved.net/assets/product_images/400x500/1688368463Shunthichuran1.png,65,shunthi churna improve metabolism body benefits lot digestive disorders specially hemorrhoids loss appetite tastelessness flatulence,benefitsingredientshow useother product infouseful ajirna vatrogshunthias directed physicianbest before months manufacturing date
churna,Divya Trikatu Churna,https://www.patanjaliayurved.net/product/ayurvedic-medicine/churna/divya-trikatu-churna/197,https://www.patanjaliayurved.net/assets/product_images/400x500/1505283900400 x 500 Trikatu Churna 10 gm.png,20,divya trikatu churna ayurvedic product useful indigestion dyspepsia cough jugular diseases different herbs materials ayurveda importance refined form powder base salt acid mixed powder warm nature digestible tasteful ignites hunger,benefitsingredientshow useother product infouseful cough cold sinusitis rhinitis tonsillitis etcgaja pippali long pepper piper longumkali marich black pepper piper nigrumshunthi adrak ginger zingiber officinalisas directed physicianbest before months manufacturing date
churna,Divya Ajmodadi Churna,https://www.patanjaliayurved.net/product/ayurvedic-medicine/churna/divya-ajmodadi-churna/5,https://www.patanjaliayurved.net/assets/product_images/400x500/1688380342AjmodadiChurna100g(1).png,70,ajmodadi churna effective cure joint inflammation joint pain arthritis heals joint reducing swelling restores bone surrounding muscle tissues health ajmodadi churna especially effective knee pain ancient formulation natural extracts effects held joint pain swelling rigidity ajmodadi churna immediate relief regain agility limbs,benefitsingredientshow useother product infouseful joint paincontrols rheumatoid arthritis lumbagoajmodvaividangdevdaruchitrakmoolsaindhanamakchhotiharadvidharapipalmoolsounthkali mirchpipplisoyaas directed physicianbest before months manufacturing date
churna,Divya Dalchini Churna,https://www.patanjaliayurved.net/product/ayurvedic-medicine/churna/divya-dalchini-churna/1051,https://www.patanjaliayurved.net/assets/product_images/400x500/1688365424Dalchinichurna100g1.png,65,dalchini churna effective natural remedy treatment prevention wide range diseases improves functioning digestive tract respiratory system strengthens immune system churna effective type diabetes supports level cholesterol glucose reduces level triglycerides wonderful churna fight excess weight stimulates metabolism normalizes digestion kidney function regular use cinnamon helps speed metabolism fat comes food removed body faster effectively,benefitsingredientshow useother product infoimproves functioning thedigestive tractrespiratory systemstrengthens immune systemcinnamon dalchinias directed physicianbest before months manufacturing date
churna,Divya Haritaki Churna,https://www.patanjaliayurved.net/product/ayurvedic-medicine/churna/divya-haritaki-churna/56,https://www.patanjaliayurved.net/assets/product_images/400x500/1688373622Haritaki1.png,40,haritaki churna haritaki clinically proven timetested remedy digestionrelated problems aids digestion increasing digestive enzymes suppresses hyper acidity improves absorption nutrients prevents constipation piles detoxifies system toxins haritaki taken time immemorial holistic healing properties,benefitsingredientshow useother product infouseful constipation indigestion piles fistula etcharitakias directed physicianbest before months manufacturing date
churna,Divya Panchkol Churna,https://www.patanjaliayurved.net/product/ayurvedic-medicine/churna/divya-panchkol-churna/130,https://www.patanjaliayurved.net/assets/product_images/400x500/1688368575Panchkolchuran1.png,45,divya panchkol churna beneficial treating nausea indigestion treat colic cold cough fever body pain helps recover loss appetite treatment asthma,benefitsingredientshow useother product infouseful indigestion loss appetite flatulence cold cough asthma etcpipplipipal moolchavyachitrak moolsounthas directed physicianbest before months manufacturing date
churna,Divya Shatavar Churna,https://www.patanjaliayurved.net/product/ayurvedic-medicine/churna/divya-shatavar-churna/831,https://www.patanjaliayurved.net/assets/product_images/400x500/1695809974shatavarchurna100g1.png,180,process pregnancy woman needs strength able stand post effects like breast feeding helps enhancing breast milk skin color gynecological issues useful general debility weakness loss immunity different herbs materials ayurvedic importance refined form churna,benefitsingredientshow useother product infoenhances milk content healthy nutritious useful muscle pains weaknessesshatavariexcipientas directed physicianbest before months manufacturing date
churna,Divya Triphala Churna,https://www.patanjaliayurved.net/product/ayurvedic-medicine/churna/divya-triphala-churna/199,https://www.patanjaliayurved.net/assets/product_images/400x500/16883660031.png,30,triphala churnais ayurvedic product beneficial vision related troubles constipation stomach problems base salt acid mixed powder warm nature digestible tasteful ignites hunger,benefitsingredientshow useother product infouseful eye disorders constipation gastric disorderseach g prepared fromharadbahedaamlaas directed physicianbest before months manufacturing date
churna,Divya Udarkalp Churna,https://www.patanjaliayurved.net/product/ayurvedic-medicine/churna/divya-udarkalp-churna/204,https://www.patanjaliayurved.net/assets/product_images/400x500/1688365972UdarkalpChurna1.png,65,medicine suppresses biles laxative purgative medicine divya udarkalp churna cleans stomach treats constipation use produce problem irritation intestines inflames stomach fire increases digestion capacity nature women children old persons delicate strong powders sold market cause harm churna totally harmless effective different herbs materials ayurveda importance refined form powder base salt acid mixed powder warm nature digestible tasteful ignites hunger sugar candy mixed powders rich purgation quality cool bile suppressive powders formed bitter items treat fever phlegm medicines prepared herbs finely grinned dried called churna ayurveda,benefitsingredientshow useother product infodivya udarkalp churna cleans stomach treats constipationits use produce problem irritation intestinesmulethisanyarevandacinihararafennel seedsrose flowerscrystal sugarhalf spoon near grams stomach meals according disease morning evening tepid wateror directed physicianbest before months manufacturing date
churna,Divya Naagkesar Churna,https://www.patanjaliayurved.net/product/ayurvedic-medicine/churna/divya-naagkesar-churna/128,https://www.patanjaliayurved.net/assets/product_images/400x500/16883686081.png,105,divya naagkeasr churna ayurvedic product treating vomiting urinary tract disorders migraine etc chaturjata group herbs powder form spices herbal jams including chyawanprash,benefitsingredientshow useother product infouseful raktarshnaagkesaras directed physicianbest before months manufacturing date
churna,Divya Pushyanug Churna,https://www.patanjaliayurved.net/product/ayurvedic-medicine/churna/divya-pushyanug-churna/147,https://www.patanjaliayurved.net/assets/product_images/400x500/1688368494Pushyanug1.png,70,divya pushyanug churna ayurvedic product patanjali ayurved divya pharmacy different herbs materials ayurveda importance refined form powder base salt acid mixed powder warm nature digestible tasteful ignites hunger sugar candy mixed powders rich purgation quality cool bile suppressive powders formed bitter items treat phlegm medicines prepared herbs finely grinned dried called churna ayurveda,benefitsingredientshow useother product infohelps treatment phlegm ignites hungerbeldhatakiarjunablack pepperpathared sandalwoodpashanbhedhalf spoon near grams stomach meals according disease morning evening tepid wateror directed physicianbest before months manufacturing date
churna,Divya Manjishtha Churna,https://www.patanjaliayurved.net/product/ayurvedic-medicine/churna/divya-manjishtha-churna/1587,https://www.patanjaliayurved.net/assets/product_images/400x500/1688364416Manjisthachuran1.png,90,manjista churna dry powder rubia cardifolia known effective dealing lethargy sticky bowel movements fogginess useful wound healing skin diseases acne pimples blood purifying property,benefitsingredientshow useother product infoit useful wound healing skin diseases acne pimplesit blood purifying propertyuseful gouty arthritis syphilisrubia cardifoliaas advised physicianbest years manufacturing date
churna,Divya Sitopaladi Churna,https://www.patanjaliayurved.net/product/ayurvedic-medicine/churna/divya-sitopaladi-churna/176,https://www.patanjaliayurved.net/assets/product_images/400x500/16883667281.png,12,divya sitopaladi churna ayurvedic product patanjali ayurved divya pharmacy sitopaladi churna easy ayurvedic herbal powder mix best widely ayurvedic medicines cough kids sitopaladi churna known sitopaladi choorna sitopaladi choornam sitopaladi chooran etc,benefitsingredientshow useother product infouseful types cough cold kidssitopaladi churna comprises mishri vankshalochana white bamboo tree pepper cardamom cinnamonas directed physicianbest before months manufacturing date
churna,Divya Ashwagandha Churna,https://www.patanjaliayurved.net/product/ayurvedic-medicine/churna/divya-ashwagandha-churna/21,https://www.patanjaliayurved.net/assets/product_images/400x500/1688380267ASHWAGANDHACHURNA100g1.png,85,ashwagandha churna helps relief stress boosts health immunity goodness ashwagandha known indian ginseng helps recover anxiety depression helps regain strength antioxidant properties helps quick recovery ailments revitalizes body divya pharmacy brings ashwagandha churna holistic cure body mind ashwagandha churna regain perfect balance physicalemotional wellbeing,benefitsingredientshow useother product infoused rejuvenating agentcontrols depression relieves stressashwagandhaas directed physicianbest before months manufacturing date
churna,Divya Avipattikar Churna,https://www.patanjaliayurved.net/product/ayurvedic-medicine/churna/divya-avipattikar-churna/23,https://www.patanjaliayurved.net/assets/product_images/400x500/1688380229AvipattikarChurna100g1.png,60,avipattikar churna effective cure acidity indigestion constipation unhealthy unbalanced diet sedentary lifestyle leads digestionrelated problems avipattikar churna combination herbs natural extracts reduces acidity stomach relieves heartburn discomfort reduces gas formation induces intestinal movements relieving constipation avipattikar churna stimulates production digestive enzymes helps absorption nutrients avipattikar churna complete recovery digestive ailments brings immediate lasting relief,benefitsingredientshow useother product infouseful hyperacidity indigestion constipation loss appetite etcsounthkali mirchpippalharadbahedaamlanagarmothavid namakvaividanglaghu elatej patralavangnisothmishrias directed physicianbest before months manufacturing date
churna,Divya Immunogrit Churna,https://www.patanjaliayurved.net/product/ayurvedic-medicine/churna/divya-immunogrit-churna/3444,https://www.patanjaliayurved.net/assets/product_images/400x500/16883642641.png,200,patanjali divya immunogrit churna immuno modulator useful weakness provides relief infections male female reproductive problems heart issues indigestion constipation diarrhea fever allergy asthma blood infections rheumatoid arthritis helps boosting immune system chronic diseases reduces debility,benefitsingredientshow useother product infoimmuno modulatoruseful weaknessvidarikandmaidashatavarkakolishir kakoli etc gram twice daily milk directed physicianbest days date manufacturing
churna,Divya Hingvashtak Churna,https://www.patanjaliayurved.net/product/ayurvedic-medicine/churna/divya-hingvashtak-churna/1586,https://www.patanjaliayurved.net/assets/product_images/400x500/16883644651.png,130,patanjali divya hingvashtak churna treatment indigestion treatment vata imbalance vata related diseases like bloating joint diseases etc good diet supplement rheumatoid arthritis,benefitsingredientshow useother product infoit treatment anorexia indigestionit treatment vata imbalance vata related diseases like bloating joint diseases etcit good diet supplement rheumatoid arthritistrikatuajamodasaindhava lavanashweta jeerakakrishna jeerakahingugheeas directed physicianbest years manufacturing date
churna,Divya Shankhpushpi Churna,https://www.patanjaliayurved.net/product/ayurvedic-medicine/churna/divya-shankhpushpi-churna/167,https://www.patanjaliayurved.net/assets/product_images/400x500/16883684311.png,35,divya shankhpushpi churna contains shankhpushpi herb powder convolvulus pluricaulis goes directly brain treats disorders nervous system formulation age groups,benefitsingredientshow useother product inforelives pain anxiety insomnia epilepsy convulsionsalleviates stress promotes integrity nervous systemsafe use herb known effectssharpening memoryrefreshes mindshankhpushpias directed physicianbest before months manufacturing date
churna,Divya Lavan Bhaskar Churna,https://www.patanjaliayurved.net/product/ayurvedic-medicine/churna/divya-lavan-bhaskar-churna/90,https://www.patanjaliayurved.net/assets/product_images/400x500/1688369103Lawandbhaskar1.png,75,lavan bhaskar churna traditionally prepared medicine cures chronic indigestion constipation flatulence gastritis mix salts cures acidity soothes irritation stomach lining caused hyperacidity boosts digestion stimulating enzyme production,benefitsingredientshow useother product inforelieves dyspepsiacures constipation gastritissaindha namakkala namakdhaniyapipal chotipipal moolkala jeeratejpatrasamundra namakkali mirchjeerasounthanardanadal chinibadi elaichinagarmothatalispatraamaltashsochar namakas directed physicianbest before months manufacturing date
churna,Divya Brhat Gangadhar Churna,https://www.patanjaliayurved.net/product/ayurvedic-medicine/churna/divya-brhat-gangadhar-churna/1576,https://www.patanjaliayurved.net/assets/product_images/400x500/1576925420400x500.jpg,30,brhat gangadhar churna cures upset stomach dysentery diarrhea antibacterial detoxification properties flushes microorganisms toxins accumulated environment unhealthy diet system reestablishes acidity balance stimulates digestive enzymes,benefitsingredientshow useother product infouseful diarrhea dysenterymustaaralukasunthidhatakilodhrabalakabilvamocarasapathaindrayavavatsakaamrabijaprtivisalajjaluas directed physicianbest before months manufacturing date
churna,Patanjali Swet Mushli Churna,https://www.patanjaliayurved.net/product/ayurvedic-medicine/churna/patanjali-swet-mushli-churna/835,https://www.patanjaliayurved.net/assets/product_images/400x500/1688365520SwetMusliChurna100g1.png,475,patanjali swet musli churna known herbal viagra rejuvenates reproductive system boosts strength stamina useful general debility weakness loss immunity,benefitsingredientshow useother product infopatanjali swet musli churna useful general debility weakness loss immunityswet mushli asparagus adscendensas directed physicianbest before months manufacturing date
churna,Divya Shuddh Konch Beej Churna,https://www.patanjaliayurved.net/product/ayurvedic-medicine/churna/divya-shuddh-konch-beej-churna/173,https://www.patanjaliayurved.net/assets/product_images/400x500/1688368388ShuddhaKonchBeejChurn100g1.png,55,divya shuddh konch beej churna contains konch main ingredient gives experience goodness natural ayurvedic cure cures male infertility enhances physical desires  ayurvedic free effects,benefitsingredientshow useother product infouseful vaatrogkonchas directed physicianbest before months manufacturing date
guggul,Divya Yograj Guggul,https://www.patanjaliayurved.net/product/ayurvedic-medicine/guggul/divya-yograj-guggul/219,https://www.patanjaliayurved.net/assets/product_images/400x500/1688368288YograjGuggul40Tab1.png,40,yograj guggul widely ayurvedic treatment types arthritis increases digestion power complexion strength immunity mainly helpful vata imbalance diseases affecting bone joints bone marrownumber tablets mg,benefitsingredientshow useother product infouseful osteoarthritis joints painchitrak moolpippla moolajwainkala jeeravia vidangajmodsafed jeeradevdaruchabyachhoti elaichisaindha namakrasnagokhrudhaniachhoti pippaldalchinikhasyavkshartejpatrapure gheeshuddh guggulas directed physicianbest years manufacturing date
